{"$defs":{"expect-denied":{"additionalProperties":false,"properties":{"code_id":{"const":"capability-denied"},"kind":{"const":"denied"},"output":{"type":"null"}},"required":["kind","code_id","output"],"type":"object"},"hex32":{"pattern":"^[0-9a-f]{64}$","type":"string"},"member":{"additionalProperties":false,"properties":{"blake3":{"$ref":"#/$defs/hex32"},"bytes":{"maximum":67108864,"minimum":1,"type":"integer"},"record":{"enum":["MTI1","MTQ1","MTR1"]}},"required":["record","blake3","bytes"],"type":"object"},"stimulus-capability-request":{"additionalProperties":false,"properties":{"capability":{"$ref":"#/$defs/text"},"kind":{"const":"capability-request"}},"required":["kind","capability"],"type":"object"},"stimulus-network-request":{"additionalProperties":false,"properties":{"execution_profile":{"const":"deterministic-air-gapped-v1"},"kind":{"const":"network-request"}},"required":["kind","execution_profile"],"type":"object"},"subcase":{"additionalProperties":false,"properties":{"expect":{"oneOf":[{"$ref":"#/$defs/expect-denied"}]},"id":{"pattern":"^den\\.[0-9]+[a-z]?$","type":"string"},"member":{"oneOf":[{"$ref":"#/$defs/member"},{"type":"null"}]},"stimulus":{"oneOf":[{"$ref":"#/$defs/stimulus-capability-request"},{"$ref":"#/$defs/stimulus-network-request"}]},"title":{"$ref":"#/$defs/text"}},"required":["id","title","member","expect"],"type":"object"},"text":{"pattern":"^[ -~]*$","type":"string"},"u64":{"maximum":9007199254740991,"minimum":0,"type":"integer"}},"$id":"urn:pigloros:metric-conformance:case:v2:denied","$schema":"https://json-schema.org/draft/2020-12/schema","additionalProperties":false,"properties":{"algorithm":{"additionalProperties":false,"properties":{"id":{"const":"pigloros.metric.binary-calibration"},"major":{"const":1}},"required":["id","major"],"type":"object"},"family":{"const":"denied"},"schema":{"const":"pigloros.metric-conformance.case.v2"},"subcases":{"items":{"$ref":"#/$defs/subcase"},"maxItems":64,"minItems":1,"type":"array"}},"required":["schema","family","algorithm","subcases"],"title":"Metric conformance case payload, family denied","type":"object"}
