{"algorithm":{"id":"pigloros.metric.binary-calibration","major":1},"family":"denied","schema":"pigloros.metric-conformance.case.v2","subcases":[{"expect":{"code_id":"capability-denied","kind":"denied","output":null},"id":"den.1","member":{"blake3":"3e0d37ad7973a5e0b44729889f9ed533d70ec9528de87b33dd06ff96bf9d18ce","bytes":128,"record":"MTI1"},"stimulus":{"capability":"mutate-subject","kind":"capability-request"},"title":"the subject requests a capability other than read-public-bundle"},{"expect":{"code_id":"capability-denied","kind":"denied","output":null},"id":"den.2","member":{"blake3":"3e0d37ad7973a5e0b44729889f9ed533d70ec9528de87b33dd06ff96bf9d18ce","bytes":128,"record":"MTI1"},"stimulus":{"execution_profile":"deterministic-air-gapped-v1","kind":"network-request"},"title":"network use is denied: Air-Gapped is network-deny and Local declares no network"}]}
